{"Bayesian": [4, "/categories/bayesian/", {"posts": [{"date": "04/03/2017", "isodate": "2017-04-03T08:02:46-05:00", "title": "Variational Bayes and The Mean-Field Approximation", "url": "/posts/variational-bayes-and-the-mean-field-approximation/"}, {"date": "08/29/2016", "isodate": "2016-08-29T08:52:33-04:00", "title": "A Probabilistic Interpretation of Regularization", "url": "/posts/probabilistic-interpretation-of-regularization/"}, {"date": "05/14/2016", "isodate": "2016-05-14T20:43:05-04:00", "title": "A Probabilistic View of Linear Regression", "url": "/posts/a-probabilistic-view-of-regression/"}, {"date": "04/02/2016", "isodate": "2016-04-02T15:22:54-04:00", "title": "Normal Approximation to the Posterior Distribution", "url": "/posts/normal-approximations-to-the-posterior-distribution/"}]}], "Boolean": [1, "/categories/boolean/", {"posts": [{"date": "10/03/2015", "isodate": "2015-10-03T20:28:04-04:00", "title": "Accessible Satisfiability", "url": "/posts/accessible-satisfiability/"}]}], "Bradley-Terry": [1, "/categories/bradley-terry/", {"posts": [{"date": "07/19/2017", "isodate": "2017-07-19T08:51:41-04:00", "title": "Building A Table Tennis Ranking Model", "url": "/posts/building-a-table-tennis-ranking-model/"}]}], "CDF": [1, "/categories/cdf/", {"posts": [{"date": "03/12/2016", "isodate": "2016-03-12T20:08:21-05:00", "title": "The Empirical Distribution Function", "url": "/posts/the-empirical-distribution-function/"}]}], "CIFAR10": [3, "/categories/cifar10/", {"posts": [{"date": "02/18/2018", "isodate": "2018-02-18T13:55:13-05:00", "title": "Residual Networks", "url": "/posts/residual-networks/"}, {"date": "12/19/2017", "isodate": "2017-12-19T08:47:38-05:00", "title": "Variational Autoencoders with Inverse Autoregressive Flows", "url": "/posts/variational-autoencoders-with-inverse-autoregressive-flows/"}, {"date": "09/11/2017", "isodate": "2017-09-11T08:40:47-04:00", "title": "Semi-supervised Learning with Variational Autoencoders", "url": "/posts/semi-supervised-learning-with-variational-autoencoders/"}]}], "CNN": [1, "/categories/cnn/", {"posts": [{"date": "09/11/2017", "isodate": "2017-09-11T08:40:47-04:00", "title": "Semi-supervised Learning with Variational Autoencoders", "url": "/posts/semi-supervised-learning-with-variational-autoencoders/"}]}], "Collaborative Filtering": [1, "/categories/collaborative-filtering/", {"posts": [{"date": "06/11/2016", "isodate": "2016-06-11T18:00:34-04:00", "title": "Beyond Collaborative Filtering", "url": "/posts/beyond-collaborative-filtering/"}]}], "Gambler's Fallacy": [1, "/categories/gamblers-fallacy/", {"posts": [{"date": "11/01/2015", "isodate": "2015-11-01T11:08:11-04:00", "title": "The Gambler's Fallacy and The Law of Small Numbers", "url": "/posts/gamblers-fallacy-and-the-law-of-small-numbers/"}]}], "Github": [1, "/categories/github/", {"posts": [{"date": "08/02/2015", "isodate": "2015-08-02T05:03:25-04:00", "title": "A First Post", "url": "/posts/a-first-post/"}]}], "Greg Ward": [1, "/categories/greg-ward/", {"posts": [{"date": "09/06/2015", "isodate": "2015-09-06T03:04:05-04:00", "title": "Functions and Procedures", "url": "/posts/functions-and-procedures/"}]}], "James Hague": [2, "/categories/james-hague/", {"posts": [{"date": "09/06/2015", "isodate": "2015-09-06T03:04:05-04:00", "title": "Functions and Procedures", "url": "/posts/functions-and-procedures/"}, {"date": "08/02/2015", "isodate": "2015-08-02T05:03:25-04:00", "title": "A First Post", "url": "/posts/a-first-post/"}]}], "Jayne": [1, "/categories/jayne/", {"posts": [{"date": "10/14/2015", "isodate": "2015-10-14T20:30:05-04:00", "title": "Probability as Extended Logic", "url": "/posts/probability-the-logic-of-science/"}]}], "Kelly Criterion": [1, "/categories/kelly-criterion/", {"posts": [{"date": "11/15/2015", "isodate": "2015-11-15T16:13:31-05:00", "title": "Optimal Betting Strategies and The Kelly Criterion", "url": "/posts/optimal-betting-and-the-kelly-criterion/"}]}], "Kullback-Leibler": [5, "/categories/kullback-leibler/", {"posts": [{"date": "12/19/2017", "isodate": "2017-12-19T08:47:38-05:00", "title": "Variational Autoencoders with Inverse Autoregressive Flows", "url": "/posts/variational-autoencoders-with-inverse-autoregressive-flows/"}, {"date": "09/11/2017", "isodate": "2017-09-11T08:40:47-04:00", "title": "Semi-supervised Learning with Variational Autoencoders", "url": "/posts/semi-supervised-learning-with-variational-autoencoders/"}, {"date": "07/13/2017", "isodate": "2017-07-13T08:13:03-04:00", "title": "A Variational Autoencoder on the SVHN dataset", "url": "/posts/a-variational-autoencoder-on-the-svnh-dataset/"}, {"date": "05/30/2017", "isodate": "2017-05-30T08:19:36-04:00", "title": "Variational Autoencoders", "url": "/posts/variational-autoencoders/"}, {"date": "04/03/2017", "isodate": "2017-04-03T08:02:46-05:00", "title": "Variational Bayes and The Mean-Field Approximation", "url": "/posts/variational-bayes-and-the-mean-field-approximation/"}]}], "Law of Large Numbers": [1, "/categories/law-of-large-numbers/", {"posts": [{"date": "11/01/2015", "isodate": "2015-11-01T11:08:11-04:00", "title": "The Gambler's Fallacy and The Law of Small Numbers", "url": "/posts/gamblers-fallacy-and-the-law-of-small-numbers/"}]}], "Law of Small Numbers": [1, "/categories/law-of-small-numbers/", {"posts": [{"date": "11/01/2015", "isodate": "2015-11-01T11:08:11-04:00", "title": "The Gambler's Fallacy and The Law of Small Numbers", "url": "/posts/gamblers-fallacy-and-the-law-of-small-numbers/"}]}], "MADE": [2, "/categories/made/", {"posts": [{"date": "12/19/2017", "isodate": "2017-12-19T08:47:38-05:00", "title": "Variational Autoencoders with Inverse Autoregressive Flows", "url": "/posts/variational-autoencoders-with-inverse-autoregressive-flows/"}, {"date": "10/14/2017", "isodate": "2017-10-14T10:02:15-04:00", "title": "Autoregressive Autoencoders", "url": "/posts/autoregressive-autoencoders/"}]}], "MCMC": [1, "/categories/mcmc/", {"posts": [{"date": "12/13/2015", "isodate": "2015-12-13T15:05:56-05:00", "title": "Markov Chain Monte Carlo Methods, Rejection Sampling and the Metropolis-Hastings Algorithm", "url": "/posts/markov-chain-monte-carlo-mcmc-and-the-metropolis-hastings-algorithm/"}]}], "MNIST": [2, "/categories/mnist/", {"posts": [{"date": "12/19/2017", "isodate": "2017-12-19T08:47:38-05:00", "title": "Variational Autoencoders with Inverse Autoregressive Flows", "url": "/posts/variational-autoencoders-with-inverse-autoregressive-flows/"}, {"date": "10/14/2017", "isodate": "2017-10-14T10:02:15-04:00", "title": "Autoregressive Autoencoders", "url": "/posts/autoregressive-autoencoders/"}]}], "Machine Learning": [2, "/categories/machine-learning/", {"posts": [{"date": "08/22/2017", "isodate": "2017-08-22T08:32:55-04:00", "title": "The Hard Thing about Machine Learning", "url": "/posts/the-hard-thing-about-machine-learning/"}, {"date": "06/11/2016", "isodate": "2016-06-11T18:00:34-04:00", "title": "Beyond Collaborative Filtering", "url": "/posts/beyond-collaborative-filtering/"}]}], "Markov Chain": [1, "/categories/markov-chain/", {"posts": [{"date": "12/13/2015", "isodate": "2015-12-13T15:05:56-05:00", "title": "Markov Chain Monte Carlo Methods, Rejection Sampling and the Metropolis-Hastings Algorithm", "url": "/posts/markov-chain-monte-carlo-mcmc-and-the-metropolis-hastings-algorithm/"}]}], "Metropolis-Hastings": [1, "/categories/metropolis-hastings/", {"posts": [{"date": "12/13/2015", "isodate": "2015-12-13T15:05:56-05:00", "title": "Markov Chain Monte Carlo Methods, Rejection Sampling and the Metropolis-Hastings Algorithm", "url": "/posts/markov-chain-monte-carlo-mcmc-and-the-metropolis-hastings-algorithm/"}]}], "Monte Carlo": [1, "/categories/monte-carlo/", {"posts": [{"date": "12/13/2015", "isodate": "2015-12-13T15:05:56-05:00", "title": "Markov Chain Monte Carlo Methods, Rejection Sampling and the Metropolis-Hastings Algorithm", "url": "/posts/markov-chain-monte-carlo-mcmc-and-the-metropolis-hastings-algorithm/"}]}], "NP-Complete": [1, "/categories/np-complete/", {"posts": [{"date": "10/03/2015", "isodate": "2015-10-03T20:28:04-04:00", "title": "Accessible Satisfiability", "url": "/posts/accessible-satisfiability/"}]}], "Nikola": [1, "/categories/nikola/", {"posts": [{"date": "08/02/2015", "isodate": "2015-08-02T05:03:25-04:00", "title": "A First Post", "url": "/posts/a-first-post/"}]}], "PCA": [1, "/categories/pca/", {"posts": [{"date": "09/11/2017", "isodate": "2017-09-11T08:40:47-04:00", "title": "Semi-supervised Learning with Variational Autoencoders", "url": "/posts/semi-supervised-learning-with-variational-autoencoders/"}]}], "Poisson": [1, "/categories/poisson/", {"posts": [{"date": "05/14/2016", "isodate": "2016-05-14T20:43:05-04:00", "title": "A Probabilistic View of Linear Regression", "url": "/posts/a-probabilistic-view-of-regression/"}]}], "Recommendation Systems": [1, "/categories/recommendation-systems/", {"posts": [{"date": "06/11/2016", "isodate": "2016-06-11T18:00:34-04:00", "title": "Beyond Collaborative Filtering", "url": "/posts/beyond-collaborative-filtering/"}]}], "ResNet": [1, "/categories/resnet/", {"posts": [{"date": "02/18/2018", "isodate": "2018-02-18T13:55:13-05:00", "title": "Residual Networks", "url": "/posts/residual-networks/"}]}], "Rubikloud": [3, "/categories/rubikloud/", {"posts": [{"date": "08/22/2017", "isodate": "2017-08-22T08:32:55-04:00", "title": "The Hard Thing about Machine Learning", "url": "/posts/the-hard-thing-about-machine-learning/"}, {"date": "07/19/2017", "isodate": "2017-07-19T08:51:41-04:00", "title": "Building A Table Tennis Ranking Model", "url": "/posts/building-a-table-tennis-ranking-model/"}, {"date": "06/11/2016", "isodate": "2016-06-11T18:00:34-04:00", "title": "Beyond Collaborative Filtering", "url": "/posts/beyond-collaborative-filtering/"}]}], "SAT": [1, "/categories/sat/", {"posts": [{"date": "10/03/2015", "isodate": "2015-10-03T20:28:04-04:00", "title": "Accessible Satisfiability", "url": "/posts/accessible-satisfiability/"}]}], "Shannon": [1, "/categories/shannon/", {"posts": [{"date": "11/15/2015", "isodate": "2015-11-15T16:13:31-05:00", "title": "Optimal Betting Strategies and The Kelly Criterion", "url": "/posts/optimal-betting-and-the-kelly-criterion/"}]}], "Thorp": [1, "/categories/thorp/", {"posts": [{"date": "11/15/2015", "isodate": "2015-11-15T16:13:31-05:00", "title": "Optimal Betting Strategies and The Kelly Criterion", "url": "/posts/optimal-betting-and-the-kelly-criterion/"}]}], "autoencoders": [6, "/categories/autoencoders/", {"posts": [{"date": "02/18/2018", "isodate": "2018-02-18T13:55:13-05:00", "title": "Residual Networks", "url": "/posts/residual-networks/"}, {"date": "12/19/2017", "isodate": "2017-12-19T08:47:38-05:00", "title": "Variational Autoencoders with Inverse Autoregressive Flows", "url": "/posts/variational-autoencoders-with-inverse-autoregressive-flows/"}, {"date": "10/14/2017", "isodate": "2017-10-14T10:02:15-04:00", "title": "Autoregressive Autoencoders", "url": "/posts/autoregressive-autoencoders/"}, {"date": "09/11/2017", "isodate": "2017-09-11T08:40:47-04:00", "title": "Semi-supervised Learning with Variational Autoencoders", "url": "/posts/semi-supervised-learning-with-variational-autoencoders/"}, {"date": "07/13/2017", "isodate": "2017-07-13T08:13:03-04:00", "title": "A Variational Autoencoder on the SVHN dataset", "url": "/posts/a-variational-autoencoder-on-the-svnh-dataset/"}, {"date": "05/30/2017", "isodate": "2017-05-30T08:19:36-04:00", "title": "Variational Autoencoders", "url": "/posts/variational-autoencoders/"}]}], "autoregressive": [2, "/categories/autoregressive/", {"posts": [{"date": "12/19/2017", "isodate": "2017-12-19T08:47:38-05:00", "title": "Variational Autoencoders with Inverse Autoregressive Flows", "url": "/posts/variational-autoencoders-with-inverse-autoregressive-flows/"}, {"date": "10/14/2017", "isodate": "2017-10-14T10:02:15-04:00", "title": "Autoregressive Autoencoders", "url": "/posts/autoregressive-autoencoders/"}]}], "betting": [1, "/categories/betting/", {"posts": [{"date": "11/15/2015", "isodate": "2015-11-15T16:13:31-05:00", "title": "Optimal Betting Strategies and The Kelly Criterion", "url": "/posts/optimal-betting-and-the-kelly-criterion/"}]}], "bilinear": [1, "/categories/bilinear/", {"posts": [{"date": "03/13/2018", "isodate": "2018-03-13T08:24:57-05:00", "title": "Tensors, Tensors, Tensors", "url": "/posts/tensors-tensors-tensors/"}]}], "calculus": [1, "/categories/calculus/", {"posts": [{"date": "12/13/2016", "isodate": "2016-12-13T07:48:31-05:00", "title": "Lagrange Multipliers", "url": "/posts/lagrange-multipliers/"}]}], "common sense": [1, "/categories/common-sense/", {"posts": [{"date": "08/30/2015", "isodate": "2015-08-30T10:44:22-04:00", "title": "Common Sense and Investing", "url": "/posts/common-sense-and-investing/"}]}], "confidence bands": [1, "/categories/confidence-bands/", {"posts": [{"date": "03/12/2016", "isodate": "2016-03-12T20:08:21-05:00", "title": "The Empirical Distribution Function", "url": "/posts/the-empirical-distribution-function/"}]}], "confidence intervals": [1, "/categories/confidence-intervals/", {"posts": [{"date": "03/12/2016", "isodate": "2016-03-12T20:08:21-05:00", "title": "The Empirical Distribution Function", "url": "/posts/the-empirical-distribution-function/"}]}], "contravariance": [1, "/categories/contravariance/", {"posts": [{"date": "03/13/2018", "isodate": "2018-03-13T08:24:57-05:00", "title": "Tensors, Tensors, Tensors", "url": "/posts/tensors-tensors-tensors/"}]}], "covariance": [1, "/categories/covariance/", {"posts": [{"date": "03/13/2018", "isodate": "2018-03-13T08:24:57-05:00", "title": "Tensors, Tensors, Tensors", "url": "/posts/tensors-tensors-tensors/"}]}], "covectors": [1, "/categories/covectors/", {"posts": [{"date": "03/13/2018", "isodate": "2018-03-13T08:24:57-05:00", "title": "Tensors, Tensors, Tensors", "url": "/posts/tensors-tensors-tensors/"}]}], "differentials": [1, "/categories/differentials/", {"posts": [{"date": "02/26/2017", "isodate": "2017-02-26T10:08:38-05:00", "title": "The Calculus of Variations", "url": "/posts/the-calculus-of-variations/"}]}], "direct marketing": [1, "/categories/direct-marketing/", {"posts": [{"date": "02/27/2016", "isodate": "2016-02-27T20:40:41-05:00", "title": "Elementary Statistics for Direct Marketing", "url": "/posts/normal-difference-distribution/"}]}], "empirical distribution function": [1, "/categories/empirical-distribution-function/", {"posts": [{"date": "03/12/2016", "isodate": "2016-03-12T20:08:21-05:00", "title": "The Empirical Distribution Function", "url": "/posts/the-empirical-distribution-function/"}]}], "entropy": [2, "/categories/entropy/", {"posts": [{"date": "02/26/2017", "isodate": "2017-02-26T10:08:38-05:00", "title": "The Calculus of Variations", "url": "/posts/the-calculus-of-variations/"}, {"date": "01/27/2017", "isodate": "2017-01-27T09:05:00-05:00", "title": "Maximum Entropy Distributions", "url": "/posts/maximum-entropy-distributions/"}]}], "expectation-maximization": [1, "/categories/expectation-maximization/", {"posts": [{"date": "10/07/2016", "isodate": "2016-10-07T08:47:47-04:00", "title": "The Expectation-Maximization Algorithm", "url": "/posts/the-expectation-maximization-algorithm/"}]}], "first post": [1, "/categories/first-post/", {"posts": [{"date": "08/02/2015", "isodate": "2015-08-02T05:03:25-04:00", "title": "A First Post", "url": "/posts/a-first-post/"}]}], "formal": [1, "/categories/formal/", {"posts": [{"date": "10/03/2015", "isodate": "2015-10-03T20:28:04-04:00", "title": "Accessible Satisfiability", "url": "/posts/accessible-satisfiability/"}]}], "frequentist statistics": [1, "/categories/frequentist-statistics/", {"posts": [{"date": "01/09/2016", "isodate": "2016-01-09T11:22:26-05:00", "title": "A Primer on Statistical Inference and Hypothesis Testing", "url": "/posts/hypothesis-testing/"}]}], "functional programming": [1, "/categories/functional-programming/", {"posts": [{"date": "09/06/2015", "isodate": "2015-09-06T03:04:05-04:00", "title": "Functions and Procedures", "url": "/posts/functions-and-procedures/"}]}], "functions": [1, "/categories/functions/", {"posts": [{"date": "09/06/2015", "isodate": "2015-09-06T03:04:05-04:00", "title": "Functions and Procedures", "url": "/posts/functions-and-procedures/"}]}], "fundamentals": [1, "/categories/fundamentals/", {"posts": [{"date": "09/06/2015", "isodate": "2015-09-06T03:04:05-04:00", "title": "Functions and Procedures", "url": "/posts/functions-and-procedures/"}]}], "gaussian mixture models": [1, "/categories/gaussian-mixture-models/", {"posts": [{"date": "10/07/2016", "isodate": "2016-10-07T08:47:47-04:00", "title": "The Expectation-Maximization Algorithm", "url": "/posts/the-expectation-maximization-algorithm/"}]}], "generative models": [5, "/categories/generative-models/", {"posts": [{"date": "12/19/2017", "isodate": "2017-12-19T08:47:38-05:00", "title": "Variational Autoencoders with Inverse Autoregressive Flows", "url": "/posts/variational-autoencoders-with-inverse-autoregressive-flows/"}, {"date": "10/14/2017", "isodate": "2017-10-14T10:02:15-04:00", "title": "Autoregressive Autoencoders", "url": "/posts/autoregressive-autoencoders/"}, {"date": "09/11/2017", "isodate": "2017-09-11T08:40:47-04:00", "title": "Semi-supervised Learning with Variational Autoencoders", "url": "/posts/semi-supervised-learning-with-variational-autoencoders/"}, {"date": "07/13/2017", "isodate": "2017-07-13T08:13:03-04:00", "title": "A Variational Autoencoder on the SVHN dataset", "url": "/posts/a-variational-autoencoder-on-the-svnh-dataset/"}, {"date": "05/30/2017", "isodate": "2017-05-30T08:19:36-04:00", "title": "Variational Autoencoders", "url": "/posts/variational-autoencoders/"}]}], "geometric vectors": [1, "/categories/geometric-vectors/", {"posts": [{"date": "03/13/2018", "isodate": "2018-03-13T08:24:57-05:00", "title": "Tensors, Tensors, Tensors", "url": "/posts/tensors-tensors-tensors/"}]}], "hypothesis testing": [1, "/categories/hypothesis-testing/", {"posts": [{"date": "01/09/2016", "isodate": "2016-01-09T11:22:26-05:00", "title": "A Primer on Statistical Inference and Hypothesis Testing", "url": "/posts/hypothesis-testing/"}]}], "inception": [1, "/categories/inception/", {"posts": [{"date": "09/11/2017", "isodate": "2017-09-11T08:40:47-04:00", "title": "Semi-supervised Learning with Variational Autoencoders", "url": "/posts/semi-supervised-learning-with-variational-autoencoders/"}]}], "investing": [1, "/categories/investing/", {"posts": [{"date": "08/30/2015", "isodate": "2015-08-30T10:44:22-04:00", "title": "Common Sense and Investing", "url": "/posts/common-sense-and-investing/"}]}], "lagrange multipliers": [2, "/categories/lagrange-multipliers/", {"posts": [{"date": "02/26/2017", "isodate": "2017-02-26T10:08:38-05:00", "title": "The Calculus of Variations", "url": "/posts/the-calculus-of-variations/"}, {"date": "12/13/2016", "isodate": "2016-12-13T07:48:31-05:00", "title": "Lagrange Multipliers", "url": "/posts/lagrange-multipliers/"}]}], "latent variables": [1, "/categories/latent-variables/", {"posts": [{"date": "10/07/2016", "isodate": "2016-10-07T08:47:47-04:00", "title": "The Expectation-Maximization Algorithm", "url": "/posts/the-expectation-maximization-algorithm/"}]}], "linear transformations": [1, "/categories/linear-transformations/", {"posts": [{"date": "03/13/2018", "isodate": "2018-03-13T08:24:57-05:00", "title": "Tensors, Tensors, Tensors", "url": "/posts/tensors-tensors-tensors/"}]}], "logic": [1, "/categories/logic/", {"posts": [{"date": "10/14/2015", "isodate": "2015-10-14T20:30:05-04:00", "title": "Probability as Extended Logic", "url": "/posts/probability-the-logic-of-science/"}]}], "logistic": [1, "/categories/logistic/", {"posts": [{"date": "05/14/2016", "isodate": "2016-05-14T20:43:05-04:00", "title": "A Probabilistic View of Linear Regression", "url": "/posts/a-probabilistic-view-of-regression/"}]}], "manifolds": [1, "/categories/manifolds/", {"posts": [{"date": "03/13/2018", "isodate": "2018-03-13T16:24:57-05:00", "title": "Manifolds: A Gentle Introduction", "url": "/posts/manifolds/"}]}], "mean-field": [1, "/categories/mean-field/", {"posts": [{"date": "04/03/2017", "isodate": "2017-04-03T08:02:46-05:00", "title": "Variational Bayes and The Mean-Field Approximation", "url": "/posts/variational-bayes-and-the-mean-field-approximation/"}]}], "metric tensor": [2, "/categories/metric-tensor/", {"posts": [{"date": "03/13/2018", "isodate": "2018-03-13T16:24:57-05:00", "title": "Manifolds: A Gentle Introduction", "url": "/posts/manifolds/"}, {"date": "03/13/2018", "isodate": "2018-03-13T08:24:57-05:00", "title": "Tensors, Tensors, Tensors", "url": "/posts/tensors-tensors-tensors/"}]}], "models": [1, "/categories/models/", {"posts": [{"date": "01/09/2016", "isodate": "2016-01-09T11:22:26-05:00", "title": "A Primer on Statistical Inference and Hypothesis Testing", "url": "/posts/hypothesis-testing/"}]}], "normal": [1, "/categories/normal/", {"posts": [{"date": "02/27/2016", "isodate": "2016-02-27T20:40:41-05:00", "title": "Elementary Statistics for Direct Marketing", "url": "/posts/normal-difference-distribution/"}]}], "normal distribution": [2, "/categories/normal-distribution/", {"posts": [{"date": "04/02/2016", "isodate": "2016-04-02T15:22:54-04:00", "title": "Normal Approximation to the Posterior Distribution", "url": "/posts/normal-approximations-to-the-posterior-distribution/"}, {"date": "11/28/2015", "isodate": "2015-11-28T21:57:02-05:00", "title": "Sampling from a Normal Distribution", "url": "/posts/sampling-from-a-normal-distribution/"}]}], "p-values": [1, "/categories/p-values/", {"posts": [{"date": "01/09/2016", "isodate": "2016-01-09T11:22:26-05:00", "title": "A Primer on Statistical Inference and Hypothesis Testing", "url": "/posts/hypothesis-testing/"}]}], "ping pong": [1, "/categories/ping-pong/", {"posts": [{"date": "07/19/2017", "isodate": "2017-07-19T08:51:41-04:00", "title": "Building A Table Tennis Ranking Model", "url": "/posts/building-a-table-tennis-ranking-model/"}]}], "posterior": [1, "/categories/posterior/", {"posts": [{"date": "04/02/2016", "isodate": "2016-04-02T15:22:54-04:00", "title": "Normal Approximation to the Posterior Distribution", "url": "/posts/normal-approximations-to-the-posterior-distribution/"}]}], "prior": [1, "/categories/prior/", {"posts": [{"date": "04/02/2016", "isodate": "2016-04-02T15:22:54-04:00", "title": "Normal Approximation to the Posterior Distribution", "url": "/posts/normal-approximations-to-the-posterior-distribution/"}]}], "probability": [11, "/categories/probability/", {"posts": [{"date": "02/26/2017", "isodate": "2017-02-26T10:08:38-05:00", "title": "The Calculus of Variations", "url": "/posts/the-calculus-of-variations/"}, {"date": "01/27/2017", "isodate": "2017-01-27T09:05:00-05:00", "title": "Maximum Entropy Distributions", "url": "/posts/maximum-entropy-distributions/"}, {"date": "08/29/2016", "isodate": "2016-08-29T08:52:33-04:00", "title": "A Probabilistic Interpretation of Regularization", "url": "/posts/probabilistic-interpretation-of-regularization/"}, {"date": "05/14/2016", "isodate": "2016-05-14T20:43:05-04:00", "title": "A Probabilistic View of Linear Regression", "url": "/posts/a-probabilistic-view-of-regression/"}, {"date": "04/02/2016", "isodate": "2016-04-02T15:22:54-04:00", "title": "Normal Approximation to the Posterior Distribution", "url": "/posts/normal-approximations-to-the-posterior-distribution/"}, {"date": "02/27/2016", "isodate": "2016-02-27T20:40:41-05:00", "title": "Elementary Statistics for Direct Marketing", "url": "/posts/normal-difference-distribution/"}, {"date": "12/13/2015", "isodate": "2015-12-13T15:05:56-05:00", "title": "Markov Chain Monte Carlo Methods, Rejection Sampling and the Metropolis-Hastings Algorithm", "url": "/posts/markov-chain-monte-carlo-mcmc-and-the-metropolis-hastings-algorithm/"}, {"date": "11/28/2015", "isodate": "2015-11-28T21:57:02-05:00", "title": "Sampling from a Normal Distribution", "url": "/posts/sampling-from-a-normal-distribution/"}, {"date": "11/15/2015", "isodate": "2015-11-15T16:13:31-05:00", "title": "Optimal Betting Strategies and The Kelly Criterion", "url": "/posts/optimal-betting-and-the-kelly-criterion/"}, {"date": "11/01/2015", "isodate": "2015-11-01T11:08:11-04:00", "title": "The Gambler's Fallacy and The Law of Small Numbers", "url": "/posts/gamblers-fallacy-and-the-law-of-small-numbers/"}, {"date": "10/14/2015", "isodate": "2015-10-14T20:30:05-04:00", "title": "Probability as Extended Logic", "url": "/posts/probability-the-logic-of-science/"}]}], "procedures": [1, "/categories/procedures/", {"posts": [{"date": "09/06/2015", "isodate": "2015-09-06T03:04:05-04:00", "title": "Functions and Procedures", "url": "/posts/functions-and-procedures/"}]}], "ranking": [1, "/categories/ranking/", {"posts": [{"date": "07/19/2017", "isodate": "2017-07-19T08:51:41-04:00", "title": "Building A Table Tennis Ranking Model", "url": "/posts/building-a-table-tennis-ranking-model/"}]}], "regression": [1, "/categories/regression/", {"posts": [{"date": "05/14/2016", "isodate": "2016-05-14T20:43:05-04:00", "title": "A Probabilistic View of Linear Regression", "url": "/posts/a-probabilistic-view-of-regression/"}]}], "regularization": [1, "/categories/regularization/", {"posts": [{"date": "08/29/2016", "isodate": "2016-08-29T08:52:33-04:00", "title": "A Probabilistic Interpretation of Regularization", "url": "/posts/probabilistic-interpretation-of-regularization/"}]}], "rejection sampling": [1, "/categories/rejection-sampling/", {"posts": [{"date": "12/13/2015", "isodate": "2015-12-13T15:05:56-05:00", "title": "Markov Chain Monte Carlo Methods, Rejection Sampling and the Metropolis-Hastings Algorithm", "url": "/posts/markov-chain-monte-carlo-mcmc-and-the-metropolis-hastings-algorithm/"}]}], "residual networks": [1, "/categories/residual-networks/", {"posts": [{"date": "02/18/2018", "isodate": "2018-02-18T13:55:13-05:00", "title": "Residual Networks", "url": "/posts/residual-networks/"}]}], "sample size": [1, "/categories/sample-size/", {"posts": [{"date": "02/27/2016", "isodate": "2016-02-27T20:40:41-05:00", "title": "Elementary Statistics for Direct Marketing", "url": "/posts/normal-difference-distribution/"}]}], "sampling": [3, "/categories/sampling/", {"posts": [{"date": "04/02/2016", "isodate": "2016-04-02T15:22:54-04:00", "title": "Normal Approximation to the Posterior Distribution", "url": "/posts/normal-approximations-to-the-posterior-distribution/"}, {"date": "12/13/2015", "isodate": "2015-12-13T15:05:56-05:00", "title": "Markov Chain Monte Carlo Methods, Rejection Sampling and the Metropolis-Hastings Algorithm", "url": "/posts/markov-chain-monte-carlo-mcmc-and-the-metropolis-hastings-algorithm/"}, {"date": "11/28/2015", "isodate": "2015-11-28T21:57:02-05:00", "title": "Sampling from a Normal Distribution", "url": "/posts/sampling-from-a-normal-distribution/"}]}], "satisficing": [1, "/categories/satisficing/", {"posts": [{"date": "08/02/2015", "isodate": "2015-08-02T05:03:25-04:00", "title": "A First Post", "url": "/posts/a-first-post/"}]}], "semi-supervised learning": [1, "/categories/semi-supervised-learning/", {"posts": [{"date": "09/11/2017", "isodate": "2017-09-11T08:40:47-04:00", "title": "Semi-supervised Learning with Variational Autoencoders", "url": "/posts/semi-supervised-learning-with-variational-autoencoders/"}]}], "statistical inference": [1, "/categories/statistical-inference/", {"posts": [{"date": "01/09/2016", "isodate": "2016-01-09T11:22:26-05:00", "title": "A Primer on Statistical Inference and Hypothesis Testing", "url": "/posts/hypothesis-testing/"}]}], "svhn": [1, "/categories/svhn/", {"posts": [{"date": "07/13/2017", "isodate": "2017-07-13T08:13:03-04:00", "title": "A Variational Autoencoder on the SVHN dataset", "url": "/posts/a-variational-autoencoder-on-the-svnh-dataset/"}]}], "systems": [1, "/categories/systems/", {"posts": [{"date": "08/22/2017", "isodate": "2017-08-22T08:32:55-04:00", "title": "The Hard Thing about Machine Learning", "url": "/posts/the-hard-thing-about-machine-learning/"}]}], "table tennis": [1, "/categories/table-tennis/", {"posts": [{"date": "07/19/2017", "isodate": "2017-07-19T08:51:41-04:00", "title": "Building A Table Tennis Ranking Model", "url": "/posts/building-a-table-tennis-ranking-model/"}]}], "tensors": [1, "/categories/tensors/", {"posts": [{"date": "03/13/2018", "isodate": "2018-03-13T08:24:57-05:00", "title": "Tensors, Tensors, Tensors", "url": "/posts/tensors-tensors-tensors/"}]}], "variational calculus": [6, "/categories/variational-calculus/", {"posts": [{"date": "12/19/2017", "isodate": "2017-12-19T08:47:38-05:00", "title": "Variational Autoencoders with Inverse Autoregressive Flows", "url": "/posts/variational-autoencoders-with-inverse-autoregressive-flows/"}, {"date": "09/11/2017", "isodate": "2017-09-11T08:40:47-04:00", "title": "Semi-supervised Learning with Variational Autoencoders", "url": "/posts/semi-supervised-learning-with-variational-autoencoders/"}, {"date": "07/13/2017", "isodate": "2017-07-13T08:13:03-04:00", "title": "A Variational Autoencoder on the SVHN dataset", "url": "/posts/a-variational-autoencoder-on-the-svnh-dataset/"}, {"date": "05/30/2017", "isodate": "2017-05-30T08:19:36-04:00", "title": "Variational Autoencoders", "url": "/posts/variational-autoencoders/"}, {"date": "04/03/2017", "isodate": "2017-04-03T08:02:46-05:00", "title": "Variational Bayes and The Mean-Field Approximation", "url": "/posts/variational-bayes-and-the-mean-field-approximation/"}, {"date": "02/26/2017", "isodate": "2017-02-26T10:08:38-05:00", "title": "The Calculus of Variations", "url": "/posts/the-calculus-of-variations/"}]}], "verification": [1, "/categories/verification/", {"posts": [{"date": "10/03/2015", "isodate": "2015-10-03T20:28:04-04:00", "title": "Accessible Satisfiability", "url": "/posts/accessible-satisfiability/"}]}]}